{
  "$schema": "https://json-schema.org/draft/2020-12/schema",
  "type": "object",
  "additionalProperties": false,
  "required": ["artifact_class", "empirical", "scientific_status", "evidence_eligible", "expert_validated", "claim_ids", "model_key", "model_id", "revision", "license_id", "architecture", "model_type", "runtime_root", "runtime_files", "num_hidden_layers", "hidden_size", "vocab_size", "effective_context", "final_transformer_block_tuple_index", "tokenizer_metadata_class", "expected_runtime_tokenizer_class", "fast_offsets_required", "pad_side", "trust_remote_code", "source_receipt_path", "source_receipt_sha256", "official_audit_path", "official_audit_sha256", "config_fact_provenance", "tokenizer_fact_provenance", "card_path"],
  "properties": {
    "artifact_class": {"const": "a0x-model-card"}, "empirical": {"const": true}, "scientific_status": {"const": "exploratory"}, "evidence_eligible": {"const": false}, "expert_validated": {"const": false}, "claim_ids": {"type": "array", "maxItems": 0},
    "model_key": {"enum": ["smollm2_360m", "qwen3_0_6b_base", "gpt2", "smollm2_135m", "gpt_neo_125m", "qwen2_5_0_5b"]}, "model_id": {"type": "string", "minLength": 1}, "revision": {"type": "string", "pattern": "^[a-f0-9]{40}$"}, "license_id": {"type": "string", "minLength": 1}, "architecture": {"type": "string", "minLength": 1}, "model_type": {"enum": ["llama", "qwen3", "gpt2", "gpt_neo", "qwen2"]}, "runtime_root": {"$ref": "#/$defs/path"}, "runtime_files": {"type": "array", "minItems": 1, "items": {"$ref": "#/$defs/runtime_file"}},
    "num_hidden_layers": {"type": "integer", "minimum": 1}, "hidden_size": {"type": "integer", "minimum": 1}, "vocab_size": {"type": "integer", "minimum": 1}, "effective_context": {"type": "integer", "minimum": 1}, "final_transformer_block_tuple_index": {"type": "integer", "minimum": 1},
    "tokenizer_metadata_class": {"type": ["string", "null"]}, "expected_runtime_tokenizer_class": {"type": "string", "minLength": 1}, "fast_offsets_required": {"type": "boolean"}, "pad_side": {"type": ["string", "null"], "enum": ["left", "right", null]}, "trust_remote_code": {"const": false},
    "source_receipt_path": {"$ref": "#/$defs/path"}, "source_receipt_sha256": {"$ref": "#/$defs/sha"}, "official_audit_path": {"$ref": "#/$defs/path"}, "official_audit_sha256": {"$ref": "#/$defs/sha"}, "config_fact_provenance": {"$ref": "#/$defs/fact_provenance"}, "tokenizer_fact_provenance": {"$ref": "#/$defs/fact_provenance"}, "card_path": {"$ref": "#/$defs/path"}
  },
  "$defs": {
    "sha": {"type": "string", "pattern": "^[a-f0-9]{64}$"}, "path": {"type": "string", "pattern": "^(?!/)(?!.*\\.\\.)[A-Za-z0-9._/-]+$"},
    "runtime_file": {"type": "object", "additionalProperties": false, "required": ["path", "size_bytes", "sha256"], "properties": {"path": {"$ref": "#/$defs/path"}, "size_bytes": {"type": "integer", "minimum": 1}, "sha256": {"$ref": "#/$defs/sha"}}},
    "fact_provenance": {"type": "object", "additionalProperties": false, "required": ["source_path", "source_sha256", "field_pointers"], "properties": {"source_path": {"$ref": "#/$defs/path"}, "source_sha256": {"$ref": "#/$defs/sha"}, "field_pointers": {"type": "object", "additionalProperties": {"type": "string", "minLength": 1}, "minProperties": 1}}}
  }
}
