{"artifact_class":"a0x-model-card","empirical":true,"scientific_status":"exploratory","evidence_eligible":false,"expert_validated":false,"claim_ids":[],"model_key":"smollm2_360m","model_id":"HuggingFaceTB/SmolLM2-360M","revision":"f8027fd0eaeea54caa13c31d31b9fdc459c38b49","license_id":"Apache-2.0","architecture":"LlamaForCausalLM","model_type":"llama","runtime_root":"artifacts/models/smollm2-360m-f8027fd0","runtime_files":[{"path":"config.json","size_bytes":689,"sha256":"34f7801487078de7e434e19162c497e5cc6ff397080e40e8586627cb68a5168a"},{"path":"generation_config.json","size_bytes":111,"sha256":"2056c988e990b0d13670f63f2f3b87b3b6d07edaf7a3416998ba27dab2d8a059"},{"path":"merges.txt","size_bytes":466391,"sha256":"0b54e8aa4e53d5383e2e4bc635a56b43f9647f7b13832d5d9ecd8f82dac4f510"},{"path":"model.safetensors","size_bytes":723674912,"sha256":"7aaff6661428bed033abba9522bec81938678642cca3181fe752b6ca9e1e540f"},{"path":"special_tokens_map.json","size_bytes":831,"sha256":"e786b595b9a23148bf1630df78d9037a048ea671e48bfd3549a1e3c233742bb3"},{"path":"tokenizer.json","size_bytes":2104556,"sha256":"9ca9acddb6525a194ec8ac7a87f24fbba7232a9a15ffa1af0c1224fcd888e47c"},{"path":"tokenizer_config.json","size_bytes":3658,"sha256":"4bb9af56a342753d39374f4016a16574cab299fe088e896f425ce3c433f61424"},{"path":"vocab.json","size_bytes":800662,"sha256":"82b84012e3add4d01d12ba14442026e49b8cbbaead1f79ecf3d919784f82dc79"},{"path":"README.md","size_bytes":6623,"sha256":"631f842e4a02262e07fc522ede86c816114541319dea53dbf86bac4539a24ac9"}],"num_hidden_layers":32,"hidden_size":960,"vocab_size":49152,"effective_context":8192,"final_transformer_block_tuple_index":32,"tokenizer_metadata_class":"GPT2Tokenizer","expected_runtime_tokenizer_class":"GPT2TokenizerFast","fast_offsets_required":true,"pad_side":null,"trust_remote_code":false,"source_receipt_path":"results/a0r2/preexecution/smollm2-360m-f8027fd0/integrity-receipt.json","source_receipt_sha256":"57424b6ef65ea1ffe94f98170eee0aa5c884158f85fa92b251bb67a78a749cd3","official_audit_path":"docs/reference/smollm2-runtime-contract.md","official_audit_sha256":"2635808ca375729ad95f486eadf93efdc205f2458644568a1caeeac9fd353d18","config_fact_provenance":{"source_path":"docs/reference/smollm2-runtime-contract.md","source_sha256":"2635808ca375729ad95f486eadf93efdc205f2458644568a1caeeac9fd353d18","field_pointers":{"model_type":"`model_type: llama`","architecture":"`LlamaForCausalLM`","num_hidden_layers":"32 transformer layers","hidden_size":"hidden size 960","vocab_size":"exact configuration","effective_context":"exact configuration","final_transformer_block_tuple_index":"tuple index 32"}},"tokenizer_fact_provenance":{"source_path":"docs/EXP001_ADDITIONAL_MODEL_RUNTIME.md","source_sha256":"3df5d9b5912be50f937e11ebd53ad5ba818467a7338591d1f91de76399a60120","field_pointers":{"tokenizer_metadata_class":"`tokenizer_config.json` declares `GPT2Tokenizer`","expected_runtime_tokenizer_class":"fast AutoTokenizer path","fast_offsets_required":"fast AutoTokenizer path"}},"card_path":"experiments/a0x-six-model/model-cards/smollm2_360m.json"}
