{"artifact_class":"a0x-model-card","empirical":true,"scientific_status":"exploratory","evidence_eligible":false,"expert_validated":false,"claim_ids":[],"model_key":"qwen3_0_6b_base","model_id":"Qwen/Qwen3-0.6B-Base","revision":"da87bfb608c14b7cf20ba1ce41287e8de496c0cd","license_id":"Apache-2.0","architecture":"Qwen3ForCausalLM","model_type":"qwen3","runtime_root":"artifacts/models/qwen3-0.6b-base-da87bfb","runtime_files":[{"path":"config.json","size_bytes":727,"sha256":"504a6b58c4271583724e66584b6b7698aea18450209df6b2f7582df0e89cee59"},{"path":"generation_config.json","size_bytes":138,"sha256":"8c970692323e3ea0e9b8b0a4dca79388d31226e41f83c9fd6014804280ebf6e8"},{"path":"merges.txt","size_bytes":1671853,"sha256":"8831e4f1a044471340f7c0a83d7bd71306a5b867e95fd870f74d0c5308a904d5"},{"path":"model.safetensors","size_bytes":1192135096,"sha256":"cd2a512003e2f9f3cd3c32a9c3573f820bb28c940f73c57b1ddaa983d9223eba"},{"path":"tokenizer.json","size_bytes":7031645,"sha256":"c0382117ea329cdf097041132f6d735924b697924d6f6fc3945713e96ce87539"},{"path":"tokenizer_config.json","size_bytes":9678,"sha256":"3c04ed3ca964ea2f6b2b5faf0dc4d31aec1cb1e8b4bcf63f402d295046b422b5"},{"path":"vocab.json","size_bytes":2776833,"sha256":"ca10d7e9fb3ed18575dd1e277a2579c16d108e32f27439684afa0e10b1440910"}],"num_hidden_layers":28,"hidden_size":1024,"vocab_size":151936,"effective_context":32768,"final_transformer_block_tuple_index":28,"tokenizer_metadata_class":"Qwen2Tokenizer","expected_runtime_tokenizer_class":"Qwen2TokenizerFast","fast_offsets_required":true,"pad_side":null,"trust_remote_code":false,"source_receipt_path":"results/exp001-comparative/preexecution/qwen-integrity-receipt.json","source_receipt_sha256":"97dc04943ddf7bffcc709028d67aec4e6edc08a1c5bad160ef50d49028580519","official_audit_path":"docs/EXP001_QWEN3_OUTLIER_ANALYSIS.md","official_audit_sha256":"98cda7c529956cc970f83168cb1dfda32a44de78fae221ac445b5ec68c2be015","config_fact_provenance":{"source_path":"docs/EXP001_QWEN3_OUTLIER_ANALYSIS.md","source_sha256":"98cda7c529956cc970f83168cb1dfda32a44de78fae221ac445b5ec68c2be015","field_pointers":{"model_type":"Qwen3-0.6B","architecture":"Qwen3-0.6B","num_hidden_layers":"Qwen3-0.6B","hidden_size":"Qwen3-0.6B","vocab_size":"Qwen3-0.6B","effective_context":"Qwen3-0.6B","final_transformer_block_tuple_index":"Qwen3-0.6B"}},"tokenizer_fact_provenance":{"source_path":"docs/EXP001_QWEN3_OUTLIER_ANALYSIS.md","source_sha256":"98cda7c529956cc970f83168cb1dfda32a44de78fae221ac445b5ec68c2be015","field_pointers":{"tokenizer_metadata_class":"Qwen3-0.6B","expected_runtime_tokenizer_class":"Qwen3-0.6B","fast_offsets_required":"Qwen3-0.6B"}},"card_path":"experiments/a0x-six-model/model-cards/qwen3_0_6b_base.json"}
