{"artifact_class":"a0x-model-card","empirical":true,"scientific_status":"exploratory","evidence_eligible":false,"expert_validated":false,"claim_ids":[],"model_key":"gpt2","model_id":"openai-community/gpt2","revision":"607a30d783dfa663caf39e06633721c8d4cfcd7e","license_id":"MIT","architecture":"GPT2LMHeadModel","model_type":"gpt2","runtime_root":"artifacts/models/gpt2-607a30d7","runtime_files":[{"path":"config.json","size_bytes":665,"sha256":"0daed7749b4f02b8f76240d5444551d7b08712dab4d0adb8239c56ba823bb7b4"},{"path":"generation_config.json","size_bytes":124,"sha256":"ed0b32ac72c0f5f44a719abb2d7786ea5146c871f83717b7f2018065954de02b"},{"path":"merges.txt","size_bytes":456318,"sha256":"1ce1664773c50f3e0cc8842619a93edc4624525b728b188a9e0be33b7726adc5"},{"path":"model.safetensors","size_bytes":548105171,"sha256":"248dfc3911869ec493c76e65bf2fcf7f615828b0254c12b473182f0f81d3a707"},{"path":"tokenizer.json","size_bytes":1355256,"sha256":"8414cab924d8b9b33013f0d221c5862f365ee9be39c5c2bfae8a5a9e970478a6"},{"path":"tokenizer_config.json","size_bytes":26,"sha256":"5e04eb606e3a1583530a42e36c2a6b6615c86f34fe77e44d9ddeb43ff940931f"},{"path":"vocab.json","size_bytes":1042301,"sha256":"196139668be63f3b5d6574427317ae82f612a97c5d1cdaf36ed2256dbf636783"}],"num_hidden_layers":12,"hidden_size":768,"vocab_size":50257,"effective_context":1024,"final_transformer_block_tuple_index":12,"tokenizer_metadata_class":null,"expected_runtime_tokenizer_class":"GPT2TokenizerFast","fast_offsets_required":true,"pad_side":null,"trust_remote_code":false,"source_receipt_path":"results/exp001-comparative/preexecution/gpt2-integrity-receipt.json","source_receipt_sha256":"6f26644c26a3c6bca0adec01b01984d1755f05b8fecd03e142467cc31a625c11","official_audit_path":"docs/EXP001_ADDITIONAL_MODEL_RUNTIME.md","official_audit_sha256":"3df5d9b5912be50f937e11ebd53ad5ba818467a7338591d1f91de76399a60120","config_fact_provenance":{"source_path":"docs/EXP001_ADDITIONAL_MODEL_RUNTIME.md","source_sha256":"3df5d9b5912be50f937e11ebd53ad5ba818467a7338591d1f91de76399a60120","field_pointers":{"model_type":"`gpt2`","architecture":"`GPT2LMHeadModel`","num_hidden_layers":"12 layers","hidden_size":"hidden 768","vocab_size":"vocabulary 50,257","effective_context":"context 1,024","final_transformer_block_tuple_index":"12 layers"}},"tokenizer_fact_provenance":{"source_path":"docs/EXP001_ADDITIONAL_MODEL_RUNTIME.md","source_sha256":"3df5d9b5912be50f937e11ebd53ad5ba818467a7338591d1f91de76399a60120","field_pointers":{"tokenizer_metadata_class":"no explicit `tokenizer_class`","expected_runtime_tokenizer_class":"GPT-2 byte-level files","fast_offsets_required":"GPT-2 byte-level files"}},"card_path":"experiments/a0x-six-model/model-cards/gpt2.json"}
