{"artifact_class":"a0x-model-card","empirical":true,"scientific_status":"exploratory","evidence_eligible":false,"expert_validated":false,"claim_ids":[],"model_key":"gpt_neo_125m","model_id":"EleutherAI/gpt-neo-125m","revision":"21def0189f5705e2521767faed922f1f15e7d7db","license_id":"MIT","architecture":"GPTNeoForCausalLM","model_type":"gpt_neo","runtime_root":"artifacts/models/gpt-neo-125m-21def018","runtime_files":[{"path":"config.json","size_bytes":1007,"sha256":"dace197ce91788731063527367b0a6766d7d3a4ab72c671fabf16dbbf9037e16"},{"path":"generation_config.json","size_bytes":119,"sha256":"a7996263aa24aca6c74d9edfe19dbb3af742c572ada10f73c88c3a5e30ba5c14"},{"path":"merges.txt","size_bytes":456318,"sha256":"1ce1664773c50f3e0cc8842619a93edc4624525b728b188a9e0be33b7726adc5"},{"path":"model.safetensors","size_bytes":525979192,"sha256":"52738cbfb54e25a232598242f60ef19ee193d36090b98fe649b10c02724b3521"},{"path":"special_tokens_map.json","size_bytes":357,"sha256":"a00e1f660c842693e7f667898759c24eb538c2dbb09b91c22dbde1b45d4cdee8"},{"path":"tokenizer.json","size_bytes":2107652,"sha256":"f6ed3d307010c244c22aeffbde05f419cf277c23e64cf98b673cac5449cfeff5"},{"path":"tokenizer_config.json","size_bytes":727,"sha256":"fd1d9aed595c7ad9e64cf65c74e94bddc9dc1608e178a4f60380c8373813f30f"},{"path":"vocab.json","size_bytes":898669,"sha256":"03087853bc70c618b66e7c7a43e787d2db4c469416beac9a483e53dad1f72f27"}],"num_hidden_layers":12,"hidden_size":768,"vocab_size":50257,"effective_context":2048,"final_transformer_block_tuple_index":12,"tokenizer_metadata_class":"GPT2Tokenizer","expected_runtime_tokenizer_class":"GPT2TokenizerFast","fast_offsets_required":true,"pad_side":"right","trust_remote_code":false,"source_receipt_path":"results/exp001-comparative/preexecution/gpt-neo-125m-integrity-receipt.json","source_receipt_sha256":"4b56fc4ae478c26741a350afcae0440ab7041471c7885c40878e16664d1f27e8","official_audit_path":"docs/EXP001_MODEL_OFFICIAL_DOC_AUDIT.md","official_audit_sha256":"003d2d6865c463e8acbbffbfb384586ad77908bfd5b06bad0942e91569eef6c0","config_fact_provenance":{"source_path":"docs/EXP001_MODEL_OFFICIAL_DOC_AUDIT.md","source_sha256":"003d2d6865c463e8acbbffbfb384586ad77908bfd5b06bad0942e91569eef6c0","field_pointers":{"model_type":"`gpt_neo`","architecture":"`GPTNeoForCausalLM`","num_hidden_layers":"12 layers","hidden_size":"hidden size 768","vocab_size":"vocabulary 50,257","effective_context":"model context 2,048","final_transformer_block_tuple_index":"12 layers"}},"tokenizer_fact_provenance":{"source_path":"docs/EXP001_MODEL_OFFICIAL_DOC_AUDIT.md","source_sha256":"003d2d6865c463e8acbbffbfb384586ad77908bfd5b06bad0942e91569eef6c0","field_pointers":{"tokenizer_metadata_class":"`GPT2Tokenizer`","expected_runtime_tokenizer_class":"Fast-tokenizer boundary","fast_offsets_required":"return_offsets_mapping"}},"card_path":"experiments/a0x-six-model/model-cards/gpt_neo_125m.json"}
