{"artifact_class":"a0x-model-card","empirical":true,"scientific_status":"exploratory","evidence_eligible":false,"expert_validated":false,"claim_ids":[],"model_key":"qwen2_5_0_5b","model_id":"Qwen/Qwen2.5-0.5B","revision":"060db6499f32faf8b98477b0a26969ef7d8b9987","license_id":"Apache-2.0","architecture":"Qwen2ForCausalLM","model_type":"qwen2","runtime_root":"artifacts/models/qwen2.5-0.5b-060db649","runtime_files":[{"path":"config.json","size_bytes":681,"sha256":"479dcf0c5286339e41ad3992cd08ae88a467c4187587936248e2b7c96283484b"},{"path":"generation_config.json","size_bytes":138,"sha256":"8c970692323e3ea0e9b8b0a4dca79388d31226e41f83c9fd6014804280ebf6e8"},{"path":"merges.txt","size_bytes":1671839,"sha256":"599bab54075088774b1733fde865d5bd747cbcc7a547c5bc12610e874e26f5e3"},{"path":"model.safetensors","size_bytes":988097824,"sha256":"88c142557820ccad55bb59756bfcfcf891de9cc6202816bd346445188a0ed342"},{"path":"tokenizer.json","size_bytes":7031645,"sha256":"c0382117ea329cdf097041132f6d735924b697924d6f6fc3945713e96ce87539"},{"path":"tokenizer_config.json","size_bytes":7228,"sha256":"c91efca15ceff6e9ee9424db58a6f59cd41294e550a86cbd07e3c1fb500b34f9"},{"path":"vocab.json","size_bytes":2776833,"sha256":"ca10d7e9fb3ed18575dd1e277a2579c16d108e32f27439684afa0e10b1440910"}],"num_hidden_layers":24,"hidden_size":896,"vocab_size":151936,"effective_context":32768,"final_transformer_block_tuple_index":24,"tokenizer_metadata_class":"Qwen2Tokenizer","expected_runtime_tokenizer_class":"Qwen2TokenizerFast","fast_offsets_required":true,"pad_side":null,"trust_remote_code":false,"source_receipt_path":"results/exp001-comparative/preexecution/qwen2.5-0.5b-integrity-receipt.json","source_receipt_sha256":"08c5459dc266f5389833a51f13de492c8bf75d962e756809220969ff34ad5998","official_audit_path":"docs/EXP001_MODEL_OFFICIAL_DOC_AUDIT.md","official_audit_sha256":"003d2d6865c463e8acbbffbfb384586ad77908bfd5b06bad0942e91569eef6c0","config_fact_provenance":{"source_path":"docs/EXP001_MODEL_OFFICIAL_DOC_AUDIT.md","source_sha256":"003d2d6865c463e8acbbffbfb384586ad77908bfd5b06bad0942e91569eef6c0","field_pointers":{"model_type":"`qwen2`","architecture":"`Qwen2ForCausalLM`","num_hidden_layers":"24 layers","hidden_size":"hidden size 896","vocab_size":"vocabulary 151,936","effective_context":"32,768","final_transformer_block_tuple_index":"24 layers"}},"tokenizer_fact_provenance":{"source_path":"docs/EXP001_MODEL_OFFICIAL_DOC_AUDIT.md","source_sha256":"003d2d6865c463e8acbbffbfb384586ad77908bfd5b06bad0942e91569eef6c0","field_pointers":{"tokenizer_metadata_class":"`Qwen2Tokenizer`","expected_runtime_tokenizer_class":"Fast-tokenizer boundary","fast_offsets_required":"return_offsets_mapping"}},"card_path":"experiments/a0x-six-model/model-cards/qwen2_5_0_5b.json"}
